PubmedID,Title,Publication Date,Non-academic Author(s),Company Affiliation(s),Corresponding Author Email
40634661,Monitoring of antibodies against SARS-CoV-2 over 2 years and characterization of immune responses following Omicron infection in a South Indian community cohort.,2025,"Madhavan, Ramya; Gupta, Divya; Babji, Sudhir; Syed, Chanduni; Saravanan, Poornima; Kumar, Ajith; Immanuel, Sushil; Gandhi, Vaishnavi; Eswaran, Akilandeswari; Dhanapal, Pavithra; Raj, Lakshmi; Gopal, Soundari; George, Anna; Kang, Gagandeep","The Wellcome Trust Research Laboratory, Christian Medical College, Vellore, India.",
40632736,Forecasting high-risk areas for dengue outbreaks in China: A trend analysis of Aedes albopictus and Aedes aegypti distributions from 2014 to 2030.,2025,"Chen, Qi; Guan, Xuhua","Hubei Provincial Center for Disease Control and Prevention, Wuhan, China.",
40632654,Structural serology of polyclonal antibody responses to mRNA-1273 and NVX-CoV2373 COVID-19 vaccines.,2025,"Rehman, Asma; Guebre-Xabier, Mimi; Girard, Bethany; Das, Rituparna; Edwards, Darin K; Patel, Nita; Smith, Gale","Moderna, Inc., Cambridge, MA 02142, USA.; Novavax, Inc., 21 Firstfield Road, Gaithersburg, MD 20878, USA.",
40632557,Mycophenolic acid treatment drives the emergence of novel SARS-CoV-2 variants.,2025,"Haid, Sibylle; Pietschmann, Thomas","TWINCORE, Centre for Experimental and Clinical Infection Research, A Joint Venture between Helmholtz-Centre for Infection Research and Hannover Medical School, Hannover 30625, Germany.",
40631743,Decoding the transcriptome from bulk RNA of infection-naïve versus imprinted patients with SARS-CoV-2 Omicron B.1.1.529.,2025,"Sonnleitner, Sissy Therese; Walder, Samira; Hinterbichler, Eva; Poernbacher, Roswitha; Walder, Gernot","Department of Virology, Medical Laboratory, Dr. Gernot Walder GmbH, Ausservillgraten, Austria.",
